{
  "$schema": "https://json-schema.org/draft/2020-12/schema",
  "$id": "cadrage-rework.schema.json",
  "title": "Cadrage d'un rework FastDev",
  "type": "object",
  "allOf": [{ "$ref": "document-envelope.schema.json" }],
  "unevaluatedProperties": false,
  "required": [
    "schema_version", "author_agent_id", "id", "feature_id", "type", "sequence", "created_at", "depends_on_document_ids",
    "probleme", "resultat_attendu", "perimetre", "zones_impactees", "strategie", "criteres_acceptation",
    "tests_attendus", "risques", "definition_de_fini"
  ],
  "properties": {
    "schema_version": { "const": 3 },
    "author_agent_id": { "type": "string" },
    "id": { "type": "string" },
    "feature_id": { "type": "string" },
    "type": { "const": "cadrage_rework" },
    "sequence": { "type": "integer", "minimum": 1 },
    "created_at": { "type": "string", "format": "date-time" },
    "depends_on_document_ids": { "type": "array", "maxItems": 0 },
    "probleme": { "type": "string", "minLength": 1 },
    "resultat_attendu": { "type": "string", "minLength": 1 },
    "perimetre": {
      "type": "object",
      "additionalProperties": false,
      "required": ["inclus", "exclus"],
      "properties": {
        "inclus": { "type": "array", "minItems": 1, "items": { "type": "string", "minLength": 1 } },
        "exclus": { "type": "array", "minItems": 1, "items": { "type": "string", "minLength": 1 } }
      }
    },
    "zones_impactees": { "type": "array", "minItems": 1, "items": { "type": "string", "minLength": 1 } },
    "strategie": { "type": "string", "minLength": 1 },
    "criteres_acceptation": {
      "type": "array",
      "minItems": 4,
      "items": {
        "type": "object",
        "additionalProperties": false,
        "required": ["id", "dimension", "critere", "preuve_attendue"],
        "properties": {
          "id": { "type": "string", "pattern": "^[A-Za-z0-9][A-Za-z0-9._:-]{0,127}$" },
          "dimension": { "enum": ["code", "fonctionnel", "ux", "securite"] },
          "critere": { "type": "string", "minLength": 1 },
          "preuve_attendue": { "type": "string", "minLength": 1 }
        }
      },
      "allOf": [
        { "contains": { "type": "object", "properties": { "dimension": { "const": "code" } }, "required": ["dimension"] } },
        { "contains": { "type": "object", "properties": { "dimension": { "const": "fonctionnel" } }, "required": ["dimension"] } },
        { "contains": { "type": "object", "properties": { "dimension": { "const": "ux" } }, "required": ["dimension"] } },
        { "contains": { "type": "object", "properties": { "dimension": { "const": "securite" } }, "required": ["dimension"] } }
      ]
    },
    "tests_attendus": { "type": "array", "minItems": 1, "items": { "type": "string", "minLength": 1 } },
    "risques": {
      "type": "array",
      "minItems": 1,
      "items": {
        "type": "object",
        "additionalProperties": false,
        "required": ["id", "risque", "mitigation"],
        "properties": {
          "id": { "type": "string", "minLength": 1 },
          "risque": { "type": "string", "minLength": 1 },
          "mitigation": { "type": "string", "minLength": 1 }
        }
      }
    },
    "definition_de_fini": { "type": "array", "minItems": 1, "items": { "type": "string", "minLength": 1 } }
  }
}
